{"all_expected_outcomes":true,"campaign_id":"e2-exact-ik-cache-owner-001","campaign_sha256":"1f9b14fcd4fd76f068902efcf6ac3944435b051aed1b828f4ba3eec82e5200eb","case_count":6,"cases":[{"after_owner_snapshot":{"active":true,"cache":{"active":true,"cache_snapshot_sha256":"98dd9498f37da772543492ede419ac68739c38954ec742ee8bd296d2a06b85c4","capacity_skips":0,"context_epoch_sha256":"8cb9fd370fee1c714fb6f3db132163deb3c38e00916d90bfe99d975263dd3ac0","controller_commands":[],"decision_input":false,"entry_count":46,"generation":0,"hardware_access":false,"hardware_commands_generated":0,"hits":68,"lookups":114,"maximum_entries":256,"misses":46,"physical_authority":false,"schema":"rocell.typing_exact_ik_result_cache_snapshot.v1","service_instance_id":"typing-exact-ik-cache-owner-campaign-normal","stores":46,"timing_used_for_admission":false},"context_epoch_sha256":"8cb9fd370fee1c714fb6f3db132163deb3c38e00916d90bfe99d975263dd3ac0","controller_commands":[],"decision_input":false,"generation":0,"hardware_access":false,"hardware_commands_generated":0,"invalidations":0,"maximum_entries":256,"owner_snapshot_sha256":"fd34bbce7df717ac3b72a76db0d00c28c2970231320ed3d3892f9593ae3c8ea7","physical_authority":false,"ready":true,"refresh_failures":0,"reloads":0,"restarts":0,"retired_caches":0,"run_failures":0,"runs":2,"schema":"rocell.typing_exact_ik_cache_owner_snapshot.v1","service_instance_id":"typing-exact-ik-cache-owner-campaign-normal","timing_used_for_admission":false},"case":"NORMAL_COLD_WARM","execution_status":"PASSED","old_cache_retired":false,"receipt_matches_reference":true,"receipt_sha256":"4b2f82592ae6aa39db8aae8a6480e9f5741b3cac2f51cb4aaf60077728a212fc","status":"PASS","transition":"NONE"},{"after_owner_snapshot":{"active":true,"cache":{"active":true,"cache_snapshot_sha256":"8aeb479626c07f1fbb22fdc087e661575ba2892d527113998edcf322d41b4b4e","capacity_skips":0,"context_epoch_sha256":"8cb9fd370fee1c714fb6f3db132163deb3c38e00916d90bfe99d975263dd3ac0","controller_commands":[],"decision_input":false,"entry_count":46,"generation":1,"hardware_access":false,"hardware_commands_generated":0,"hits":11,"lookups":57,"maximum_entries":256,"misses":46,"physical_authority":false,"schema":"rocell.typing_exact_ik_result_cache_snapshot.v1","service_instance_id":"typing-exact-ik-cache-owner-campaign-reload","stores":46,"timing_used_for_admission":false},"context_epoch_sha256":"8cb9fd370fee1c714fb6f3db132163deb3c38e00916d90bfe99d975263dd3ac0","controller_commands":[],"decision_input":false,"generation":1,"hardware_access":false,"hardware_commands_generated":0,"invalidations":0,"maximum_entries":256,"owner_snapshot_sha256":"1ca2c47313f6187ca509289a739326a92c8e5c3f2df9d07e7efa59efb5684f2a","physical_authority":false,"ready":true,"refresh_failures":0,"reloads":1,"restarts":0,"retired_caches":1,"run_failures":0,"runs":2,"schema":"rocell.typing_exact_ik_cache_owner_snapshot.v1","service_instance_id":"typing-exact-ik-cache-owner-campaign-reload","timing_used_for_admission":false},"case":"RELOAD_RETIREMENT","execution_status":"PASSED","old_cache_retired":true,"receipt_matches_reference":true,"receipt_sha256":"4b2f82592ae6aa39db8aae8a6480e9f5741b3cac2f51cb4aaf60077728a212fc","status":"PASS","transition":"RELOAD"},{"after_owner_snapshot":{"active":true,"cache":{"active":true,"cache_snapshot_sha256":"5873a056e686541aac50b54138c4e91a8c6c483ba494ad1af69b624f4ca01624","capacity_skips":0,"context_epoch_sha256":"8cb9fd370fee1c714fb6f3db132163deb3c38e00916d90bfe99d975263dd3ac0","controller_commands":[],"decision_input":false,"entry_count":46,"generation":0,"hardware_access":false,"hardware_commands_generated":0,"hits":11,"lookups":57,"maximum_entries":256,"misses":46,"physical_authority":false,"schema":"rocell.typing_exact_ik_result_cache_snapshot.v1","service_instance_id":"typing-exact-ik-cache-owner-campaign-restart-new","stores":46,"timing_used_for_admission":false},"context_epoch_sha256":"8cb9fd370fee1c714fb6f3db132163deb3c38e00916d90bfe99d975263dd3ac0","controller_commands":[],"decision_input":false,"generation":0,"hardware_access":false,"hardware_commands_generated":0,"invalidations":0,"maximum_entries":256,"owner_snapshot_sha256":"e1b9d35b6bec3091f13143cbeb21a30853106bad3e7bc2cc05004cb0cc05f2b4","physical_authority":false,"ready":true,"refresh_failures":0,"reloads":0,"restarts":1,"retired_caches":1,"run_failures":0,"runs":2,"schema":"rocell.typing_exact_ik_cache_owner_snapshot.v1","service_instance_id":"typing-exact-ik-cache-owner-campaign-restart-new","timing_used_for_admission":false},"case":"RESTART_RETIREMENT","execution_status":"PASSED","old_cache_retired":true,"receipt_matches_reference":true,"receipt_sha256":"4b2f82592ae6aa39db8aae8a6480e9f5741b3cac2f51cb4aaf60077728a212fc","status":"PASS","transition":"RESTART"},{"after_owner_snapshot":{"active":false,"cache":{"active":false,"cache_snapshot_sha256":"9bc762cc5319416dada1a070022983104b26875b4b7b88c419de3a85fbb03b6f","capacity_skips":0,"context_epoch_sha256":"8cb9fd370fee1c714fb6f3db132163deb3c38e00916d90bfe99d975263dd3ac0","controller_commands":[],"decision_input":false,"entry_count":0,"generation":0,"hardware_access":false,"hardware_commands_generated":0,"hits":11,"lookups":57,"maximum_entries":256,"misses":46,"physical_authority":false,"schema":"rocell.typing_exact_ik_result_cache_snapshot.v1","service_instance_id":"typing-exact-ik-cache-owner-campaign-invalidate","stores":46,"timing_used_for_admission":false},"context_epoch_sha256":"8cb9fd370fee1c714fb6f3db132163deb3c38e00916d90bfe99d975263dd3ac0","controller_commands":[],"decision_input":false,"generation":0,"hardware_access":false,"hardware_commands_generated":0,"invalidations":1,"maximum_entries":256,"owner_snapshot_sha256":"4327026cb3d17ddf942fd5b1fdda3ff99530881c46fef92a9874ca2e6317e808","physical_authority":false,"ready":false,"refresh_failures":0,"reloads":0,"restarts":0,"retired_caches":1,"run_failures":0,"runs":1,"schema":"rocell.typing_exact_ik_cache_owner_snapshot.v1","service_instance_id":"typing-exact-ik-cache-owner-campaign-invalidate","timing_used_for_admission":false},"case":"EXPLICIT_INVALIDATION","execution_status":"BLOCKED","old_cache_retired":true,"receipt_matches_reference":null,"receipt_sha256":null,"status":"PASS","transition":"INVALIDATE"},{"after_owner_snapshot":{"active":true,"cache":{"active":false,"cache_snapshot_sha256":"b5ba0ef7c9fd88eab0f27476116b3a61e4986c023a95eaa01c6796784d95643b","capacity_skips":0,"context_epoch_sha256":"8cb9fd370fee1c714fb6f3db132163deb3c38e00916d90bfe99d975263dd3ac0","controller_commands":[],"decision_input":false,"entry_count":0,"generation":0,"hardware_access":false,"hardware_commands_generated":0,"hits":11,"lookups":57,"maximum_entries":256,"misses":46,"physical_authority":false,"schema":"rocell.typing_exact_ik_result_cache_snapshot.v1","service_instance_id":"typing-exact-ik-cache-owner-campaign-reload-failure","stores":46,"timing_used_for_admission":false},"context_epoch_sha256":"8cb9fd370fee1c714fb6f3db132163deb3c38e00916d90bfe99d975263dd3ac0","controller_commands":[],"decision_input":false,"generation":0,"hardware_access":false,"hardware_commands_generated":0,"invalidations":0,"maximum_entries":256,"owner_snapshot_sha256":"2cf61d9618758f4d0feca7d80848aeb98cabb7050521c5cc5291f323332fc832","physical_authority":false,"ready":false,"refresh_failures":1,"reloads":0,"restarts":0,"retired_caches":1,"run_failures":0,"runs":1,"schema":"rocell.typing_exact_ik_cache_owner_snapshot.v1","service_instance_id":"typing-exact-ik-cache-owner-campaign-reload-failure","timing_used_for_admission":false},"case":"RELOAD_REFRESH_FAILURE","execution_status":"BLOCKED","old_cache_retired":true,"receipt_matches_reference":null,"receipt_sha256":null,"status":"PASS","transition":"RELOAD"},{"after_owner_snapshot":{"active":true,"cache":{"active":false,"cache_snapshot_sha256":"70c5c9c0750559e0d474e7712e2ef36e18aa10311de099312d606831c074681f","capacity_skips":0,"context_epoch_sha256":"8cb9fd370fee1c714fb6f3db132163deb3c38e00916d90bfe99d975263dd3ac0","controller_commands":[],"decision_input":false,"entry_count":0,"generation":0,"hardware_access":false,"hardware_commands_generated":0,"hits":11,"lookups":57,"maximum_entries":256,"misses":46,"physical_authority":false,"schema":"rocell.typing_exact_ik_result_cache_snapshot.v1","service_instance_id":"typing-exact-ik-cache-owner-campaign-restart-failure","stores":46,"timing_used_for_admission":false},"context_epoch_sha256":"8cb9fd370fee1c714fb6f3db132163deb3c38e00916d90bfe99d975263dd3ac0","controller_commands":[],"decision_input":false,"generation":0,"hardware_access":false,"hardware_commands_generated":0,"invalidations":0,"maximum_entries":256,"owner_snapshot_sha256":"98d1ba3293ec62f65dcf459f00d7353ef55801e0db63366701adfa4d8e6ea992","physical_authority":false,"ready":false,"refresh_failures":1,"reloads":0,"restarts":0,"retired_caches":1,"run_failures":0,"runs":1,"schema":"rocell.typing_exact_ik_cache_owner_snapshot.v1","service_instance_id":"typing-exact-ik-cache-owner-campaign-restart-failure","timing_used_for_admission":false},"case":"RESTART_REFRESH_FAILURE","execution_status":"BLOCKED","old_cache_retired":true,"receipt_matches_reference":null,"receipt_sha256":null,"status":"PASS","transition":"RESTART"}],"controller_commands":[],"controller_opened":false,"decision_hashes_unchanged":true,"diagnostics_used_for_admission":false,"environment":{"benchmark_entrypoint":"software/scripts/run_typing_exact_ik_cache_owner_campaign_v1.py","captured_at_utc":"2026-09-29T23:16:16.544810Z","environment_sha256":"db728eb1b668da24375081cda0716d924eb1c0e27dae616968dda09e9107f6c5","logical_cpu_count":24,"perf_counter_resolution_ns":100,"platform_machine":"AMD64","platform_release":"10","platform_system":"Windows","python_implementation":"CPython","python_version":"3.10.10","repository_commit":"a07ca2730f04dfccb5f072e210f8413e5c64e198","repository_dirty":false,"schema":"rocell.operational_benchmark_environment.v1"},"evidence_class":"HOST_MEASURED_OFFLINE","hardware_writes":0,"performance_a